English,Nagamese
I love it here.,moi yaate kushi bai
He was perfect.,tai perfect thakise
I didn't argue.,moi argue kura nai
I'll guide you.,moi tuike raata dikhavo
"A coke, please.","ekta coke ,morom bara"
He can't drive.,tai drive kurivole napare
I want a raise.,moike raise lake
He deserved it.,tai ke laki thakise
I saw the file.,moi file ke dikeh se
I wear glasses.,moi glasses lakai
Are you afraid?,tui bhoii khai ase?
Try to resist.,resist kurivole try kurivi
I sell flowers.,moi flowers bikai
I hiccup a lot.,moi hiccup bishi kure
I'll wait here.,moi yaate rukhivo
I hate lawyers.,moi lawyers ke khin lake
I owe him $100.,100dollar loi kina dikeh se
I can't use it.,moi use kurivole napare
I need a stamp.,moike stamp lake
I lost my keys.,moi keys haraise
We're sinking.,moi khan dube ase
I want to quit.,moi chaari vole mon ase
I need friends.,moike saathi laake
I feel honored.,moi honored feel kure
He has a lunch.,taike lunch ase
How long is it?,kiman lamba ase?
We never lose.,moikhan nahare
We missed you.,moi khan tui ke yaat ahi thakise
I take it back.,moi wapas loi ase
You're sleepy.,tui gomavo mon ase
What'll we do?,moi khan ki kurivo?
We don't know.,moi khan najane
I'll just wait.,moi eina rukhivo
Autumn is here.,autumn toh ahise
Here she comes.,eitu maiki ahi ase
I sneeze a lot.,moi sneeze bishi kure
Happy New Year!,kushi ba nutun saal
Do I annoy you?,moi tuike disturb kure?
He is a genius.,tai genious ase
I like to talk.,moi khota kovole kushi bai
He can't do it.,tai naparivo kurivole
I got divorced.,moi divorce hoise
How did it end?,kina khotom hoise/
Where is Mary?,mary kute ase?
We'll both go.,moijun bhi javo
He's a slacker.,tai bishi alchi manu ase
I just met him.,moi taike eitiya lok baise
What about us?,moi khan la toh kina?
I'm right here.,moi yate ase
I am in a spot.,moi bhi duk det ase
I will survive.,moi namurivo
I'm not skinny.,moi patla nai
We'll find it.,moi khan bara bisarivo
I was barefoot.,moi theng khaali thakise
Watch my back.,moila biche savi
You are drunk!,tui oethina ase?
We need money.,moikhan ke map lake
Hi! What's new?,"hi,ki nutun kuri ase"
Happy birthday!,jonom baa din kushi 
You're crafty.,tui crafty ase
I saw it on TV.,moi tv ke dikeh se
Are we sinking?,moi khan dubii ase?
I want a donut.,moi ke donut lake
We want peace.,moikhan ke peace lake
Don't you care?,morom nakure?
I ran upstairs.,moi opor dey bolai se
I must protest.,moi protest kurivole lake
I need a snack.,moike snack lake
Do not do that.,eitu nakurivi
I love the sun.,moi sun kushi bai
Can I sit down?,moi buhivo barivo?
I need answers.,moike answer lake
He was stunned.,tai hila napara hoise
He wants to go.,tai javole mon ase
I'm wide awake.,moi oethina ase
I was careless.,moi thik bara thakania
I'll go change.,moi change kuri savo
Come back home.,khor wapas ahivi
You're sneaky.,tui bishi sneaky ase
You can do it.,tui kurivole barivo
I didn't do it.,moi bara kura nai
I need support.,moike support lake
He felt uneasy.,tai uneasy feel hoise
I love to cook.,moi cook kurivole kushi bai
He's depressed.,tai mon duk dey ase
I was offended.,moi kushi baania
I smell coffee.,moi coffee khuntai
We're stuffed.,moi khan toh full ase
I don't follow.,moi follow nakure
He came by car.,tai car bara ahise
Tom's violent.,tom bishi khussa oethe
I'm illiterate.,moi kitab bura manu nahoi
I'm successful.,moi successful ase
I dislike eggs.,moi anda kushi napai
We're fasting.,moikhan fasting kuri ase
"A beer, please.","beer ekta ,morom bara"
We must focus.,moikhan focus kurivole lake
I study French.,moi fench bure
How's your job?,tuila kaam kina ase?
He lay face up.,tai face opor dey khomai
He walked away.,tai jai jaise
Give me a hint.,moike hint divi
We're not mad.,moikhan gussa dey nai
Drop me a line.,line chaRI DIVI
I'm astonished.,moi astonished hoise
I don't belong.,moi yaate la manu nahoi
Enter the room.,room bithor javi
I study Korean.,moi korean bure
"Calm down, son.","aste bara,bachha"
Watch closely.,osor bara savi
Don't be naive.,baccha nisana nathakibi
I had some fun.,moi olop toh fun kuri se
He bit his lip.,taila lips dey kamori sey
Cows eat grass.,guru gaas khai
You look sick.,tui bemaar dekhe
I will testify.,moi koi divo
I'm very short.,moi bishi khatta ase
I just guessed.,moi aine bhabi saala
I was grateful.,moi toh kushi baise
He's very open.,tai bishi ghulla ase
I'm still here.,moi yaati ase
How tall is he?,tai kiman lamb ase?
I was upstairs.,moi upstrairs thaakise
Can I go first?,moi first javo bariv?
I don't get it.,moi buji baanai
I'll see to it.,moi sai savo
I do apologize.,moi maaf mangi ase
I love bananas.,moi bananas kushi bai
You're famous.,tui toh famous ase
I thought hard.,moi bhabhise daan hobo
I love secrets.,moi secrets kushi bai
He's an outlaw.,tai outlaw asw
I live upstate.,moi upstairs dey thake
I already know.,moi jani thakise
We were there.,moi khan yaate thakise
He's an ex-con.,tai ex con ase
I didn't speak.,moi khota kwa nai
I'll cancel it.,moi nolobo
I raise cattle.,moi czttle ke sai
Can I sit here?,moi yaate buhivo barivo?
We can't fail.,moi khan fail nahvole lake
Don't be crazy.,pagla nahobi
He was patient.,tai patient thakise
You are wrong.,tui galti ase
Did I break it?,moi biya kurise?
You're grumpy.,tui grumpy ase
He asked me to.,tai bara kurivi koise
I want to stay.,moi yaate thakivole mon ase
He hated lying.,tai misa kwa kushi napai
"Hey, what's up?","hoi,ki kuri ase?"
Enjoy the show.,show enjoy kurivi
I serve no one.,moi kun ke bhi serve nakure
Do you read me?,tui moi ke bure?
I like jogging.,moi jogging kushi bai
What did I do?,moi ki kurise?
I like my life.,moi la life kushi bau
I'll pay later.,moi biche dey divo
We're sloshed.,moi khan sloshed hoise
Go take a walk.,cho beravi olop
We're jealous.,moi mon juli ase
He was panting.,tai painting kuri thakise
Don't show off.,bishi nadikhai vi
Are we friends?,moi khan saathi ase?
He works a lot.,tai bishi kaam kure
We've no time.,moi khan time nai
I hate my life.,moila life ke khin lake
We can try it.,moi aaro kushish kurivole barivo
I love sunsets.,moi sunsets kushi bai
We're ashamed.,moikhan ashamed ase
We're stunned.,moi khan toh rukhi jaise
Come back soon.,jolti ahivi
I'll get these.,moi eitu lobo
He lost a book.,tai kitab harai se
We're stalled.,moi khan toh stalled hoise
